{
  "project": {
    "title": "Premium Desk Lamp Product Story",
    "goal": "Create a 50-second ecommerce product video showing a premium adjustable desk lamp improving a focused evening work session.",
    "target_runtime_seconds": 50,
    "aspect_ratio": "9:16",
    "platform": "TikTok, Instagram Reels, YouTube Shorts",
    "visual_style": "realistic cinematic product footage, premium but practical",
    "scene_duration_rule": "8-10 seconds per scene"
  },
  "continuity_bible": {
    "main_subject": {
      "role": "young professional working at a desk",
      "appearance": "late 20s, calm focused expression, short dark hair, neutral skin tone",
      "wardrobe": "charcoal knit sweater, no visible logos",
      "movement_style": "small realistic movements, focused and deliberate",
      "do_not_change": [
        "face structure",
        "hair length",
        "wardrobe",
        "professional tone"
      ]
    },
    "product": {
      "name": "matte black adjustable LED desk lamp",
      "shape": "slim vertical stem, circular weighted base, horizontal light bar",
      "materials": "matte black metal with subtle satin finish",
      "required_visibility": "lamp must be clearly visible in every scene",
      "do_not_change": [
        "matte black color",
        "slim shape",
        "circular base",
        "horizontal light bar"
      ]
    },
    "location": {
      "setting": "modern apartment home office at night",
      "background": "wood desk, laptop, notebook, pen, soft shelves in background",
      "lighting": "warm lamp light as primary source, cool dim city light outside window",
      "do_not_change": [
        "night setting",
        "desk layout",
        "warm key light",
        "modern apartment office"
      ]
    },
    "camera_language": {
      "lens": "natural product-focused closeups and medium shots",
      "movement": "slow push-ins, gentle slides, controlled handheld-free motion",
      "depth_of_field": "shallow but product remains sharp"
    },
    "negative_constraints": [
      "no extra people",
      "no visible brand logos",
      "no text overlays",
      "no changing lamp design",
      "no changing wardrobe",
      "no daylight",
      "no cluttered desk",
      "no unrealistic glowing effects"
    ]
  },
  "scenes": [
    {
      "scene_number": 1,
      "duration_seconds": 8,
      "purpose": "Establish the workspace and product presence before the lamp turns on.",
      "start_state": "A dim modern home office at night with the matte black desk lamp visible but off beside a laptop and notebook.",
      "end_state": "The user's hand reaches toward the lamp control while the lamp remains the central product in frame.",
      "camera_movement": "Slow push-in from a medium desk view toward the lamp.",
      "subject_motion": "The professional enters frame partially and reaches toward the lamp.",
      "environment_motion": "Subtle city light flicker outside the window, otherwise still.",
      "continuity_references": [
        "matte black adjustable LED desk lamp",
        "modern apartment home office at night",
        "wood desk with laptop and notebook",
        "warm light not yet activated"
      ],
      "negative_constraints": [
        "no daylight",
        "no extra people",
        "no text overlays",
        "do not change desk layout"
      ],
      "start_frame_prompt": "SCENE 1 - START FRAME PROMPT\n\nCreate a still image for Premium Desk Lamp Product Story.\n\nThe image shows a dim modern apartment home office at night. A matte black adjustable LED desk lamp sits on a wood desk beside a laptop, notebook, and pen. The lamp is off but clearly visible as the hero product.\n\nSubject: no full face visible yet, only the workspace prepared for use.\nProduct: slim matte black desk lamp with circular base and horizontal light bar, off, sharply visible.\nEnvironment: modern apartment home office, night city window glow, clean wood desk.\nCamera and composition: medium vertical 9:16 product-focused shot, desk lamp slightly right of center, laptop and notebook supporting the scene.\nLighting: dim cool ambient city light, no warm lamp light yet.\nStyle: realistic cinematic ecommerce product footage, premium but practical.\n\nContinuity requirements: preserve the matte black lamp design, modern night office, wood desk, laptop, notebook, and clean uncluttered layout.\n\nDo not include: extra people, visible logos, text overlays, daylight, clutter, unrealistic glow.",
      "end_frame_prompt": "SCENE 1 - END FRAME PROMPT\n\nCreate a still image for Premium Desk Lamp Product Story.\n\nThe image shows the same dim home office desk as a young professional's hand reaches toward the lamp control. The matte black lamp remains the central product in frame and is still off.\n\nSubject: partial view of a young professional in a charcoal knit sweater, hand reaching calmly toward the lamp control.\nProduct: same slim matte black desk lamp with circular base and horizontal light bar, off, sharply visible.\nEnvironment: same modern apartment home office at night, wood desk, laptop, notebook, pen, soft shelves in background.\nCamera and composition: closer vertical 9:16 product shot, slow push-in implied, hand entering from the left side without covering the lamp.\nLighting: dim cool ambient city light, no warm lamp light yet.\nStyle: realistic cinematic ecommerce product footage, premium but practical.\n\nContinuity requirements: preserve wardrobe, lamp shape, desk layout, night setting, and subdued pre-activation lighting.\n\nDo not include: extra people, visible logos, text overlays, daylight, clutter, unrealistic glow.",
      "flow_agent_prompt": "SCENE 1 - FLOW AGENT MODE PROMPT\n\nGenerate an 8 second video clip for Premium Desk Lamp Product Story.\n\nUse the provided start frame and end frame as strict anchors. Animate a smooth transition from the start frame to the end frame.\n\nScene purpose: establish the workspace and product presence before the lamp turns on.\n\nCamera movement: slow push-in from a medium desk view toward the lamp.\n\nSubject motion: the young professional enters only partially and reaches toward the lamp control with a calm deliberate movement.\n\nEnvironment motion: subtle city light outside the window, otherwise still.\n\nContinuity requirements: preserve the matte black adjustable LED desk lamp, clean wood desk, laptop, notebook, pen, modern apartment home office at night, and dim pre-activation lighting.\n\nPreserve the continuity bible exactly: subject identity, wardrobe, product details, location, lighting, camera style, color palette, and realism level.\n\nDo not include: extra people, visible logos, text overlays, daylight, clutter, unrealistic glow, changing lamp design, changing desk layout."
    },
    {
      "scene_number": 2,
      "duration_seconds": 8,
      "purpose": "Show the lamp turning on and transforming the workspace mood.",
      "start_state": "The hand touches the lamp control in the dim workspace.",
      "end_state": "The lamp emits warm focused light across the notebook and keyboard.",
      "camera_movement": "Gentle side slide along the desk surface toward the illuminated notebook.",
      "subject_motion": "The hand taps the control, then moves away.",
      "environment_motion": "Warm light gradually fills the immediate desk area.",
      "continuity_references": [
        "same hand and charcoal sweater",
        "same matte black lamp",
        "same night office",
        "warm lamp light becomes primary source"
      ],
      "negative_constraints": [
        "no magical flare",
        "no color-changing lamp",
        "no new objects",
        "no visible UI text"
      ],
      "start_frame_prompt": "SCENE 2 - START FRAME PROMPT\n\nCreate a still image for Premium Desk Lamp Product Story.\n\nThe image shows the young professional's hand in a charcoal knit sweater touching the control on the matte black adjustable LED desk lamp in the same dim night office.\n\nSubject: partial hand and sleeve only, calm controlled gesture.\nProduct: same matte black desk lamp, control being touched, lamp just before activation.\nEnvironment: same wood desk with laptop, notebook, pen, night apartment background.\nCamera and composition: close vertical 9:16 product detail shot with the lamp control and hand clearly visible.\nLighting: dim cool ambient light just before warm activation.\nStyle: realistic cinematic ecommerce product footage.\n\nContinuity requirements: preserve lamp design, charcoal sweater, night office, and desk layout.\n\nDo not include: magical flare, extra people, visible logos, text overlays, new desk objects.",
      "end_frame_prompt": "SCENE 2 - END FRAME PROMPT\n\nCreate a still image for Premium Desk Lamp Product Story.\n\nThe image shows the same lamp now turned on, casting warm focused light across the notebook, pen, and edge of the laptop keyboard.\n\nSubject: the hand has moved away, only a subtle sleeve edge may remain near frame edge.\nProduct: same matte black adjustable LED desk lamp, warm LED light active, product sharply visible.\nEnvironment: same modern night office, wood desk, laptop, notebook, pen, shelves softly blurred.\nCamera and composition: close vertical 9:16 desk-level shot, warm light leading the eye from lamp to notebook.\nLighting: warm lamp light as primary source, cool dim city light in background.\nStyle: realistic cinematic ecommerce product footage, premium but practical.\n\nContinuity requirements: preserve exact lamp form, desk layout, night setting, and warm practical lighting.\n\nDo not include: magical glow, color-changing light, extra objects, visible logos, text overlays.",